{
    "session_id": "5646a0f4-f66b-418d-95ab-bf6127d1d695",
    "bool_ent_bpMedication": "true",
    "bpm_ent_restingHeartRate": "69",
    "cm_ent_height": 174,
    "date_ent_dob": "1986-05-06",
    "enum_ent_activityLevel": "exerciseOver3Hours",
    "enum_ent_chronicMedication": "oneOrTwoDiseases",
    "enum_ent_sex": "male",
    "enum_ent_smoker": "never",
    "kg_ent_weight": 73,
    "created_at": 1724652803,
    "email": "example@example.com",
    "flt_raw_ibi": "855.48",
    "flt_raw_rmssd": "50.83",
    "flt_raw_sdnn": "41.31",
    "flt_raw_stressIndex": "36.31049507791067",
    "int_raw_oxygen": "98",
    "int_raw_rr": "16",
    "mmHg_ent_diastolicBP": "82",
    "mmHg_ent_systolicBP": "118",
    "questions_at": 1724652830,
    "risk_adj_activityLevel": "low",
    "risk_adj_bapwv": "low",
    "risk_adj_bloodPressure": "medium",
    "risk_adj_bmi": "low",
    "risk_adj_chronicMedication": "medium",
    "risk_adj_framinghamScore": "low",
    "risk_adj_hdlC": "high",
    "risk_adj_ldlC": "medium",
    "risk_adj_metSComp": "low",
    "risk_adj_restingFitness": "low",
    "risk_adj_restingHeartRate": "low",
    "risk_adj_smokerStatus": "low",
    "risk_adj_tenYrCvd": "low",
    "risk_adj_totalCholesterol": "low",
    "risk_adj_triglycerides": "low",
    "updated_at": 1724652871,
    "yr_raw_age": 38
}